{
  "schemaVersion": "1.0.0",
  "kind": "ParameterSet",
  "parameterSetId": "mantis.doctor.fixture-positive",
  "workspaceRef": "biomemetics.mantis",
  "contextRef": "mantis.doctor.fixtures",
  "revision": "doctor-v1",
  "parameters": {
    "fixture.length": {
      "value": 10,
      "unit": "mm",
      "status": "target",
      "note": "environment fixture only"
    }
  }
}
